story,val2,persp_val,alt_persp_val,sa_order,key_resp_24.keys,key_resp_24.rt,trials_28.thisRepN,trials_28.thisTrialN,trials_28.thisN,trials_28.thisIndex,trials_28.ran,storyfile11,storyfile12,storyfile13,storyfile14,storyfile21,storyfile22,storyfile23,storyfile24,storyfile31,storyfile32,storyfile33,storyfile34,storyfile41,storyfile42,storyfile43,storyfile44,storypic11,storypic12,storypic13,storypic14,storypic21,storypic22,storypic23,storypic24,storypic31,storypic32,storypic33,storypic34,storypic41,storypic42,storypic43,storypic44,perspective1,perspective2,perspective3,perspective4,perspective10,perspective20,perspective30,perspective40,persp_pic1,persp_pic2,persp_pic3,persp_pic4,persp_pic10,persp_pic20,persp_pic30,persp_pic40,sa1_1,sa2_1,sa3_1,sa4_1,q5_1,q6_1,sa1_2,sa2_2,sa3_2,sa4_2,q5_2,q6_2,sa1_3,sa2_3,sa3_3,sa4_3,q5_3,q6_3,sa1_4,sa2_4,sa3_4,sa4_4,q5_4,q6_4,sa1_10,sa2_10,sa3_10,sa4_10,q5_10,q6_10,sa1_20,sa2_20,sa3_20,sa4_20,q5_20,q6_20,sa1_30,sa2_30,sa3_30,sa4_30,q5_30,q6_30,sa1_40,sa2_40,sa3_40,sa4_40,q5_40,q6_40,Prolific_ID,date,expName,psychopyVersion,OS,frameRate,participant,id,session,researcher,key_resp_45.keys,key_resp_45.rt,trials_64.thisRepN,trials_64.thisTrialN,trials_64.thisN,trials_64.thisIndex,trials_64.ran,img,key_resp_46.keys,key_resp_46.rt,key_resp_48.keys,key_resp_48.rt,key_resp_49.keys,key_resp_49.rt,key_resp_38.keys,key_resp_38.rt,trials_32.thisRepN,trials_32.thisTrialN,trials_32.thisN,trials_32.thisIndex,trials_32.ran,instruct,key_resp_2.keys,key_resp_2.rt,key_resp_3.keys,key_resp_3.rt,trials_33.thisRepN,trials_33.thisTrialN,trials_33.thisN,trials_33.thisIndex,trials_33.ran,key_resp_17.keys,key_resp_17.rt,key_resp_10.keys,key_resp_10.rt,key_resp_11.keys,key_resp_11.rt,key_resp_12.keys,key_resp_12.rt,key_resp_13.keys,key_resp_13.rt,key_resp_6.keys,key_resp_6.rt,trials_5.thisRepN,trials_5.thisTrialN,trials_5.thisN,trials_5.thisIndex,trials_5.ran,instructText,key_resp_22.keys,key_resp_22.rt,key_resp_21.keys,key_resp_21.rt,trials_18.thisRepN,trials_18.thisTrialN,trials_18.thisN,trials_18.thisIndex,trials_18.ran,key_resp_25.keys,key_resp_25.rt,trials.thisRepN,trials.thisTrialN,trials.thisN,trials.thisIndex,trials.ran,trials_17.thisRepN,trials_17.thisTrialN,trials_17.thisN,trials_17.thisIndex,trials_17.ran,key_resp_9.keys,key_resp_9.rt,trials_19.thisRepN,trials_19.thisTrialN,trials_19.thisN,trials_19.thisIndex,trials_19.ran,key_resp_18.keys,key_resp_18.rt,trials_22.thisRepN,trials_22.thisTrialN,trials_22.thisN,trials_22.thisIndex,trials_22.ran,key_resp_23.keys,key_resp_23.rt,trials_25.thisRepN,trials_25.thisTrialN,trials_25.thisN,trials_25.thisIndex,trials_25.ran,key_resp_4.keys,key_resp_4.rt,trials_34.thisRepN,trials_34.thisTrialN,trials_34.thisN,trials_34.thisIndex,trials_34.ran,key_resp_41.keys,key_resp_41.rt,key_resp_42.keys,key_resp_42.rt,trials_50.thisRepN,trials_50.thisTrialN,trials_50.thisN,trials_50.thisIndex,trials_50.ran,key_resp_43.keys,key_resp_43.rt,trials_53.thisRepN,trials_53.thisTrialN,trials_53.thisN,trials_53.thisIndex,trials_53.ran,key_resp_20.keys,key_resp_20.rt,trials_48.thisRepN,trials_48.thisTrialN,trials_48.thisN,trials_48.thisIndex,trials_48.ran,trials_36.thisRepN,trials_36.thisTrialN,trials_36.thisN,trials_36.thisIndex,trials_36.ran,trials_38.thisRepN,trials_38.thisTrialN,trials_38.thisN,trials_38.thisIndex,trials_38.ran,trials_41.thisRepN,trials_41.thisTrialN,trials_41.thisN,trials_41.thisIndex,trials_41.ran,trials_44.thisRepN,trials_44.thisTrialN,trials_44.thisN,trials_44.thisIndex,trials_44.ran,trials_35.thisRepN,trials_35.thisTrialN,trials_35.thisN,trials_35.thisIndex,trials_35.ran,key_resp.keys,key_resp.rt,key_resp_14.keys,key_resp_14.rt,trials_29.thisRepN,trials_29.thisTrialN,trials_29.thisN,trials_29.thisIndex,trials_29.ran,story_presses.keys,story_presses.rt,key_resp_35.keys,trials_2.thisRepN,trials_2.thisTrialN,trials_2.thisN,trials_2.thisIndex,trials_2.ran,audio,key_resp_16.keys,key_resp_16.rt,key_resp_36.keys,key_resp_36.rt,typedWord,trials_30.thisRepN,trials_30.thisTrialN,trials_30.thisN,trials_30.thisIndex,trials_30.ran,prompt,trials_65.thisRepN,trials_65.thisTrialN,trials_65.thisN,trials_65.thisIndex,trials_65.ran,shortanswer1,key_resp_27.keys,key_resp_27.rt,shortanswer2,key_resp_28.keys,key_resp_28.rt,shortanswer3,key_resp_29.keys,key_resp_29.rt,shortanswer4,key_resp_30.keys,key_resp_30.rt,shortanswer5,key_resp_31.keys,key_resp_31.rt,shortanswer6,key_resp_32.keys,key_resp_32.rt,shortanswer7,key_resp_33.keys,key_resp_33.rt,shortanswer8,key_resp_34.keys,key_resp_34.rt,key_resp_47.keys,key_resp_47.rt,trials_4.thisRepN,trials_4.thisTrialN,trials_4.thisN,trials_4.thisIndex,trials_4.ran
24,1,4,20,1,space,2.0262,0,0,0,0,1,audio_excel_sheets/11_audio.xlsx,audio_excel_sheets/12_audio.xlsx,audio_excel_sheets/13_audio.xlsx,audio_excel_sheets/14_audio.xlsx,audio_excel_sheets/21_audio.xlsx,audio_excel_sheets/22_audio.xlsx,audio_excel_sheets/23_audio.xlsx,audio_excel_sheets/24_audio.xlsx,audio_excel_sheets/31_audio.xlsx,audio_excel_sheets/32_audio.xlsx,audio_excel_sheets/33_audio.xlsx,audio_excel_sheets/34_audio.xlsx,audio_excel_sheets/41_audio.xlsx,audio_excel_sheets/42_audio.xlsx,audio_excel_sheets/43_audio.xlsx,audio_excel_sheets/44_audio.xlsx,storypics/11_storypic.jpg,storypics/12_storypic.jpg,storypics/13_storypic.jpg,storypics/14_storypic.jpg,storypics/21_storypic.jpg,storypics/22_storypic.jpg,storypics/23_storypic.jpg,storypics/24_storypic.jpg,storypics/31_storypic.jpg,storypics/32_storypic.jpg,storypics/33_storypic.jpg,storypics/34_storypic.jpg,storypics/41_storypic.jpg,storypics/42_storypic.jpg,storypics/43_storypic.jpg,storypics/44_storypic.jpg,Restaurant Critic,Airport Customer Experience Manager,Grocery Store Customer Experience Manager,Dean of Academic Studies,Couples Therapist,Wedding Planner,Business Reporter,Matchmaker,jobphotos/restaurant_critic.jpg,jobphotos/acem.jpg,jobphotos/gscem.jpg,jobphotos/dean.jpg,jobphotos/couples.jpg,jobphotos/weddingplanner.jpg,jobphotos/business_reporter.jpg,jobphotos/matchmaker.jpg,How is the restaurant decorated?,What are the menus like?,"What does each client order?
",How do the clients like the food?,How is the restaurant supplied?,How do the clients like the chairs?,"When the clients arrive at the airport, how much time do they have until their flight departs?
",What is the reason for the hold-up at security?,"Toward which gate are the clients walking?
","What section and seat does each client sit in on the plane?
",Toward which security line are the clients walking?,What section and seat are roped off on the plane?,"What is the grocery store like upon entering?
",What items do the clients pick out to buy?,"How many checkout lanes are open, and which one do the clients step into?
","How much are the groceries, and what method of payment do the clients use?
",What is the grocery store like when the clients leave?,"How many checkout lanes are closed, and which one do the clients step into?","What is the lecture hall like?
","What class are the students in, and what is the day’s lecture about?
","What is something taught in lecture?
","What is the next assessment/assignment for the class, and when is it scheduled/due?","What class are the students in, and what was yesterday’s lecture about?","What is the lecture hall’s max capacity?
",For how long has the initiator of the breakup been thinking about breaking up with his/her partner?,"What is the initial reason stated by the initiator for why he/she is breaking up?
","Does the person who is being broken up with want to break up, and what’s the reason stated by them for this?",Who wants what items back as a result of the breakup?,What is the initial reason stated by the initiator for why he/she wanted to meet?,Who wants how many letters burned as a result of the breakup?,For how long has the couple been dating?,"How many diamonds are on the ring, and what is the diamond color?","In/on what item is the ring presented?
","Who does the new fiancee text first?
",For how long has the couple known the other was going to propose?,Who does the new fiancee hug first?,What is each business person’s job title?,"How much money is at stake in the initial offer made?
",What is the name of the other industry competitor? ,With what gesture do the business partners secure the deal?,What is each business person’s salary?,How much money is at stake in the final offer made?,What object is the initiator of the interaction holding when he/she first notices the other person?,What is the initial question that begins the conversation between the couple?,When will be the next time the couple meets and for what occasion?,"What time is it when the couple parts?
",What is the initial question that ends the conversation between the couple?,What object is the initiator of the interaction holding when he/she leaves the other person?,5e31c0590d43621a12346787,2020-09-28_12h32.49.371,1_online_exp,2020.1.2,Win32,60,57,,,,,,,,,,,,,,,,,,,,,,,,,,,,,,,,,,,,,,,,,,,,,,,,,,,,,,,,,,,,,,,,,,,,,,,,,,,,,,,,,,,,,,,,,,,,,,,,,,,,,,,,,,,,,,,,,,,,,,,,,,,,,,,,,,,,,,,,,,,,,,,,,,,,,,,,,,,,,,,,,,,,,,,,,,,,,,,,,,,,,,,,,,,,,,,,,,,,,,,,,,,,,,,,,,,,,,
,,,,,,,,,,,,,,,,,,,,,,,,,,,,,,,,,,,,,,,,,,,,,,,,,,,,,,,,,,,,,,,,,,,,,,,,,,,,,,,,,,,,,,,,,,,,,,,,,,,,,,,,,,,,5e31c0590d43621a12346787,2020-09-28_12h32.49.371,1_online_exp,2020.1.2,Win32,60,57,,,,space,3.83023,0,0,0,0,1,consent/consent1.png,,,,,,,,,,,,,,,,,,,,,,,,,,,,,,,,,,,,,,,,,,,,,,,,,,,,,,,,,,,,,,,,,,,,,,,,,,,,,,,,,,,,,,,,,,,,,,,,,,,,,,,,,,,,,,,,,,,,,,,,,,,,,,,,,,,,,,,,,,,,,,,,,,,,,,,,,,,,,,,,,,,,,,,,,,,,,,,,,,,,,,,,,,,,,,,,,,,,,,,,,,,
,,,,,,,,,,,,,,,,,,,,,,,,,,,,,,,,,,,,,,,,,,,,,,,,,,,,,,,,,,,,,,,,,,,,,,,,,,,,,,,,,,,,,,,,,,,,,,,,,,,,,,,,,,,,5e31c0590d43621a12346787,2020-09-28_12h32.49.371,1_online_exp,2020.1.2,Win32,60,57,,,,space,1.81939,0,1,1,1,1,consent/consent2.png,,,,,,,,,,,,,,,,,,,,,,,,,,,,,,,,,,,,,,,,,,,,,,,,,,,,,,,,,,,,,,,,,,,,,,,,,,,,,,,,,,,,,,,,,,,,,,,,,,,,,,,,,,,,,,,,,,,,,,,,,,,,,,,,,,,,,,,,,,,,,,,,,,,,,,,,,,,,,,,,,,,,,,,,,,,,,,,,,,,,,,,,,,,,,,,,,,,,,,,,,,,
,,,,,,,,,,,,,,,,,,,,,,,,,,,,,,,,,,,,,,,,,,,,,,,,,,,,,,,,,,,,,,,,,,,,,,,,,,,,,,,,,,,,,,,,,,,,,,,,,,,,,,,,,,,,5e31c0590d43621a12346787,2020-09-28_12h32.49.371,1_online_exp,2020.1.2,Win32,60,57,,,,space,0.699435,0,2,2,2,1,consent/consent3.png,,,,,,,,,,,,,,,,,,,,,,,,,,,,,,,,,,,,,,,,,,,,,,,,,,,,,,,,,,,,,,,,,,,,,,,,,,,,,,,,,,,,,,,,,,,,,,,,,,,,,,,,,,,,,,,,,,,,,,,,,,,,,,,,,,,,,,,,,,,,,,,,,,,,,,,,,,,,,,,,,,,,,,,,,,,,,,,,,,,,,,,,,,,,,,,,,,,,,,,,,,,
,,,,,,,,,,,,,,,,,,,,,,,,,,,,,,,,,,,,,,,,,,,,,,,,,,,,,,,,,,,,,,,,,,,,,,,,,,,,,,,,,,,,,,,,,,,,,,,,,,,,,,,,,,,,5e31c0590d43621a12346787,2020-09-28_12h32.49.371,1_online_exp,2020.1.2,Win32,60,57,,,,space,0.475325,0,3,3,3,1,consent/consent4.png,,,,,,,,,,,,,,,,,,,,,,,,,,,,,,,,,,,,,,,,,,,,,,,,,,,,,,,,,,,,,,,,,,,,,,,,,,,,,,,,,,,,,,,,,,,,,,,,,,,,,,,,,,,,,,,,,,,,,,,,,,,,,,,,,,,,,,,,,,,,,,,,,,,,,,,,,,,,,,,,,,,,,,,,,,,,,,,,,,,,,,,,,,,,,,,,,,,,,,,,,,,
,,,,,,,,,,,,,,,,,,,,,,,,,,,,,,,,,,,,,,,,,,,,,,,,,,,,,,,,,,,,,,,,,,,,,,,,,,,,,,,,,,,,,,,,,,,,,,,,,,,,,,,,,,,,5e31c0590d43621a12346787,2020-09-28_12h32.49.371,1_online_exp,2020.1.2,Win32,60,57,,,,space,0.657205,0,4,4,4,1,consent/consent5.png,,,,,,,,,,,,,,,,,,,,,,,,,,,,,,,,,,,,,,,,,,,,,,,,,,,,,,,,,,,,,,,,,,,,,,,,,,,,,,,,,,,,,,,,,,,,,,,,,,,,,,,,,,,,,,,,,,,,,,,,,,,,,,,,,,,,,,,,,,,,,,,,,,,,,,,,,,,,,,,,,,,,,,,,,,,,,,,,,,,,,,,,,,,,,,,,,,,,,,,,,,,
,,,,,,,,,,,,,,,,,,,,,,,,,,,,,,,,,,,,,,,,,,,,,,,,,,,,,,,,,,,,,,,,,,,,,,,,,,,,,,,,,,,,,,,,,,,,,,,,,,,,,,,,,,,,5e31c0590d43621a12346787,2020-09-28_12h32.49.371,1_online_exp,2020.1.2,Win32,60,57,,,,,,,,,,,,return,5.122205,space,14.2795,space,10.844435,space,0.29908,0,0,0,0,1,Welcome to the Job-Simulator Task!,,,,,,,,,,,,,,,,,,,,,,,,,,,,,,,,,,,,,,,,,,,,,,,,,,,,,,,,,,,,,,,,,,,,,,,,,,,,,,,,,,,,,,,,,,,,,,,,,,,,,,,,,,,,,,,,,,,,,,,,,,,,,,,,,,,,,,,,,,,,,,,,,,,,,,,,,,,,,,,,,,,,,,,,,,,,,,,,,,,,,,,,,,,,,
,,,,,,,,,,,,,,,,,,,,,,,,,,,,,,,,,,,,,,,,,,,,,,,,,,,,,,,,,,,,,,,,,,,,,,,,,,,,,,,,,,,,,,,,,,,,,,,,,,,,,,,,,,,,5e31c0590d43621a12346787,2020-09-28_12h32.49.371,1_online_exp,2020.1.2,Win32,60,57,,,,,,,,,,,,,,,,,,space,0.23692,0,1,1,1,1,"In this experiment, you will listen to one short story.",,,,,,,,,,,,,,,,,,,,,,,,,,,,,,,,,,,,,,,,,,,,,,,,,,,,,,,,,,,,,,,,,,,,,,,,,,,,,,,,,,,,,,,,,,,,,,,,,,,,,,,,,,,,,,,,,,,,,,,,,,,,,,,,,,,,,,,,,,,,,,,,,,,,,,,,,,,,,,,,,,,,,,,,,,,,,,,,,,,,,,,,,,,,,
,,,,,,,,,,,,,,,,,,,,,,,,,,,,,,,,,,,,,,,,,,,,,,,,,,,,,,,,,,,,,,,,,,,,,,,,,,,,,,,,,,,,,,,,,,,,,,,,,,,,,,,,,,,,5e31c0590d43621a12346787,2020-09-28_12h32.49.371,1_online_exp,2020.1.2,Win32,60,57,,,,,,,,,,,,,,,,,,space,1.16042,0,2,2,2,1,"During the story, we will ask you to take on the perspective of a type of job. ",,,,,,,,,,,,,,,,,,,,,,,,,,,,,,,,,,,,,,,,,,,,,,,,,,,,,,,,,,,,,,,,,,,,,,,,,,,,,,,,,,,,,,,,,,,,,,,,,,,,,,,,,,,,,,,,,,,,,,,,,,,,,,,,,,,,,,,,,,,,,,,,,,,,,,,,,,,,,,,,,,,,,,,,,,,,,,,,,,,,,,,,,,,,,
,,,,,,,,,,,,,,,,,,,,,,,,,,,,,,,,,,,,,,,,,,,,,,,,,,,,,,,,,,,,,,,,,,,,,,,,,,,,,,,,,,,,,,,,,,,,,,,,,,,,,,,,,,,,5e31c0590d43621a12346787,2020-09-28_12h32.49.371,1_online_exp,2020.1.2,Win32,60,57,,,,,,,,,,,,,,,,,,space,2.58596,0,3,3,3,1,This perpsective will be: ,,,,,,,,,,,,,,,,,,,,,,,,,,,,,,,,,,,,,,,,,,,,,,,,,,,,,,,,,,,,,,,,,,,,,,,,,,,,,,,,,,,,,,,,,,,,,,,,,,,,,,,,,,,,,,,,,,,,,,,,,,,,,,,,,,,,,,,,,,,,,,,,,,,,,,,,,,,,,,,,,,,,,,,,,,,,,,,,,,,,,,,,,,,,,
,,,,,,,,,,,,,,,,,,,,,,,,,,,,,,,,,,,,,,,,,,,,,,,,,,,,,,,,,,,,,,,,,,,,,,,,,,,,,,,,,,,,,,,,,,,,,,,,,,,,,,,,,,,,5e31c0590d43621a12346787,2020-09-28_12h32.49.371,1_online_exp,2020.1.2,Win32,60,57,,,,,,,,,,,,,,,,,,,,,,,,,"In other words, you should try to listen to the story from the perspective of this job. This is called “job simulation.”",space,2.69276,space,3.461115,0,0,0,0,1,,,,,,,,,,,,,,,,,,,,,,,,,,,,,,,,,,,,,,,,,,,,,,,,,,,,,,,,,,,,,,,,,,,,,,,,,,,,,,,,,,,,,,,,,,,,,,,,,,,,,,,,,,,,,,,,,,,,,,,,,,,,,,,,,,,,,,,,,,,,,,,,,,,,,,,,,,,,,,,,,,,,,,,,,,,,,,,,,,,,
,,,,,,,,,,,,,,,,,,,,,,,,,,,,,,,,,,,,,,,,,,,,,,,,,,,,,,,,,,,,,,,,,,,,,,,,,,,,,,,,,,,,,,,,,,,,,,,,,,,,,,,,,,,,5e31c0590d43621a12346787,2020-09-28_12h32.49.371,1_online_exp,2020.1.2,Win32,60,57,,,,,,,,,,,,,,,,,,,,,,,,,"Before getting to the story, we will teach you 4 questions associated with the perspective to use when listening to the story. ",,,space,3.48762,0,1,1,1,1,,,,,,,,,,,,,,,,,,,,,,,,,,,,,,,,,,,,,,,,,,,,,,,,,,,,,,,,,,,,,,,,,,,,,,,,,,,,,,,,,,,,,,,,,,,,,,,,,,,,,,,,,,,,,,,,,,,,,,,,,,,,,,,,,,,,,,,,,,,,,,,,,,,,,,,,,,,,,,,,,,,,,,,,,,,,,,,,,,,,
,,,,,,,,,,,,,,,,,,,,,,,,,,,,,,,,,,,,,,,,,,,,,,,,,,,,,,,,,,,,,,,,,,,,,,,,,,,,,,,,,,,,,,,,,,,,,,,,,,,,,,,,,,,,5e31c0590d43621a12346787,2020-09-28_12h32.49.371,1_online_exp,2020.1.2,Win32,60,57,,,,,,,,,,,,,,,,,,,,,,,,,We encourage you to keep these questions in mind while listening to the story and simulating the assigned perspective.,,,space,1.785555,0,2,2,2,1,,,,,,,,,,,,,,,,,,,,,,,,,,,,,,,,,,,,,,,,,,,,,,,,,,,,,,,,,,,,,,,,,,,,,,,,,,,,,,,,,,,,,,,,,,,,,,,,,,,,,,,,,,,,,,,,,,,,,,,,,,,,,,,,,,,,,,,,,,,,,,,,,,,,,,,,,,,,,,,,,,,,,,,,,,,,,,,,,,,,
,,,,,,,,,,,,,,,,,,,,,,,,,,,,,,,,,,,,,,,,,,,,,,,,,,,,,,,,,,,,,,,,,,,,,,,,,,,,,,,,,,,,,,,,,,,,,,,,,,,,,,,,,,,,5e31c0590d43621a12346787,2020-09-28_12h32.49.371,1_online_exp,2020.1.2,Win32,60,57,,,,,,,,,,,,,,,,,,,,,,,,,"When presented with the sequence of questions in a few moments, try to remember it. ",,,space,0.846735,0,3,3,3,1,,,,,,,,,,,,,,,,,,,,,,,,,,,,,,,,,,,,,,,,,,,,,,,,,,,,,,,,,,,,,,,,,,,,,,,,,,,,,,,,,,,,,,,,,,,,,,,,,,,,,,,,,,,,,,,,,,,,,,,,,,,,,,,,,,,,,,,,,,,,,,,,,,,,,,,,,,,,,,,,,,,,,,,,,,,,,,,,,,,,
,,,,,,,,,,,,,,,,,,,,,,,,,,,,,,,,,,,,,,,,,,,,,,,,,,,,,,,,,,,,,,,,,,,,,,,,,,,,,,,,,,,,,,,,,,,,,,,,,,,,,,,,,,,,5e31c0590d43621a12346787,2020-09-28_12h32.49.371,1_online_exp,2020.1.2,Win32,60,57,,,,,,,,,,,,,,,,,,,,,,,,,Press the space bar to begin learning the sequence of questions. ,,,space,0.401115,0,4,4,4,1,,,,,,,,,,,,,,,,,,,,,,,,,,,,,,,,,,,,,,,,,,,,,,,,,,,,,,,,,,,,,,,,,,,,,,,,,,,,,,,,,,,,,,,,,,,,,,,,,,,,,,,,,,,,,,,,,,,,,,,,,,,,,,,,,,,,,,,,,,,,,,,,,,,,,,,,,,,,,,,,,,,,,,,,,,,,,,,,,,,,
,,,,,,,,,,,,,,,,,,,,,,,,,,,,,,,,,,,,,,,,,,,,,,,,,,,,,,,,,,,,,,,,,,,,,,,,,,,,,,,,,,,,,,,,,,,,,,,,,,,,,,,,,,,,5e31c0590d43621a12346787,2020-09-28_12h32.49.371,1_online_exp,2020.1.2,Win32,60,57,,,,,,,,,,,,,,,,,,,,,,,,,,,,,,,,,,,space,2.041185,space,1.351145,space,6.142925,space,2.604925,space,2.082325,space,2.49044,0,0,0,0,1,You will now be quizzed on the 4 questions.,,,,,,,,,,,,,,,,,,,,,,,,,,,,,,,,,,,,,,,,,,,,,,,,,,,,,,,,,,,,,,,,,,,,,,,,,,,,,,,,,,,,,,,,,,,,,,,,,,,,,,,,,,,,,,,,,,,,,,,,,,,,,,,,,,,,,,,,,,,,,,,,,,,,,,,,,,,,,,,,,,
,,,,,,,,,,,,,,,,,,,,,,,,,,,,,,,,,,,,,,,,,,,,,,,,,,,,,,,,,,,,,,,,,,,,,,,,,,,,,,,,,,,,,,,,,,,,,,,,,,,,,,,,,,,,5e31c0590d43621a12346787,2020-09-28_12h32.49.371,1_online_exp,2020.1.2,Win32,60,57,,,,,,,,,,,,,,,,,,,,,,,,,,,,,,,,,,,,,,,,,,,,,space,7.020715,0,1,1,1,1,"In the quiz, press the number key corresponding to the number in front of the question that comes first.
",,,,,,,,,,,,,,,,,,,,,,,,,,,,,,,,,,,,,,,,,,,,,,,,,,,,,,,,,,,,,,,,,,,,,,,,,,,,,,,,,,,,,,,,,,,,,,,,,,,,,,,,,,,,,,,,,,,,,,,,,,,,,,,,,,,,,,,,,,,,,,,,,,,,,,,,,,,,,,,,,,
,,,,,,,,,,,,,,,,,,,,,,,,,,,,,,,,,,,,,,,,,,,,,,,,,,,,,,,,,,,,,,,,,,,,,,,,,,,,,,,,,,,,,,,,,,,,,,,,,,,,,,,,,,,,5e31c0590d43621a12346787,2020-09-28_12h32.49.371,1_online_exp,2020.1.2,Win32,60,57,,,,,,,,,,,,,,,,,,,,,,,,,,,,,,,,,,,,,,,,,,,,,space,6.47617,0,2,2,2,1,"And then, press the number key for the second question, and so on for all 4 questions. ",,,,,,,,,,,,,,,,,,,,,,,,,,,,,,,,,,,,,,,,,,,,,,,,,,,,,,,,,,,,,,,,,,,,,,,,,,,,,,,,,,,,,,,,,,,,,,,,,,,,,,,,,,,,,,,,,,,,,,,,,,,,,,,,,,,,,,,,,,,,,,,,,,,,,,,,,,,,,,,,,,
,,,,,,,,,,,,,,,,,,,,,,,,,,,,,,,,,,,,,,,,,,,,,,,,,,,,,,,,,,,,,,,,,,,,,,,,,,,,,,,,,,,,,,,,,,,,,,,,,,,,,,,,,,,,5e31c0590d43621a12346787,2020-09-28_12h32.49.371,1_online_exp,2020.1.2,Win32,60,57,,,,,,,,,,,,,,,,,,,,,,,,,,,,,,,,,,,,,,,,,,,,,space,3.964895,0,3,3,3,1,"If you select the wrong question in the sequence, you will see the sequence of questions again and retake the quiz until you have successfully ordered the questions. ",,,,,,,,,,,,,,,,,,,,,,,,,,,,,,,,,,,,,,,,,,,,,,,,,,,,,,,,,,,,,,,,,,,,,,,,,,,,,,,,,,,,,,,,,,,,,,,,,,,,,,,,,,,,,,,,,,,,,,,,,,,,,,,,,,,,,,,,,,,,,,,,,,,,,,,,,,,,,,,,,,
,,,,,,,,,,,,,,,,,,,,,,,,,,,,,,,,,,,,,,,,,,,,,,,,,,,,,,,,,,,,,,,,,,,,,,,,,,,,,,,,,,,,,,,,,,,,,,,,,,,,,,,,,,,,5e31c0590d43621a12346787,2020-09-28_12h32.49.371,1_online_exp,2020.1.2,Win32,60,57,,,,,,,,,,,,,,,,,,,,,,,,,,,,,,,,,,,,,,,,,,,,,space,0.955405,0,4,4,4,1,Press the space bar to begin the quiz.,,,,,,,,,,,,,,,,,,,,,,,,,,,,,,,,,,,,,,,,,,,,,,,,,,,,,,,,,,,,,,,,,,,,,,,,,,,,,,,,,,,,,,,,,,,,,,,,,,,,,,,,,,,,,,,,,,,,,,,,,,,,,,,,,,,,,,,,,,,,,,,,,,,,,,,,,,,,,,,,,,
,,,,,,,,,,,,,,,,,,,,,,,,,,,,,,,,,,,,,,,,,,,,,,,,,,,,,,,,,,,,,,,,,,,,,,,,,,,,,,,,,,,,,,,,,,,,,,,,,,,,,,,,,,,,5e31c0590d43621a12346787,2020-09-28_12h32.49.371,1_online_exp,2020.1.2,Win32,60,57,,,,,,,,,,,,,,,,,,,,,,,,,,,,,,,,,,,space,0.550405,space,1.19107,space,1.862895,space,0.312635,space,0.212955,,,,,,,,,space,1.11572,space,0.18347,0,0,0,0,1,,,,,,,,,,,,,,,,,,,,,,,,,,,,,,,,,,,,,,,,,,,,,,,,,,,,,,,,,,,,,,,,,,,,,,,,,,,,,,,,,,,,,,,,,,,,,,,,,,,,,,,,,,,,,,,,,,,,,,,,,,,,,,,,,,,,,,,,,,,,,,,,,,,,,,,,,
,,,,,,,,,,,,,,,,,,,,,,,,,,,,,,,,,,,,,,,,,,,,,,,,,,,,,,,,,,,,,,,,,,,,,,,,,,,,,,,,,,,,,,,,,,,,,,,,,,,,,,,,,,,,5e31c0590d43621a12346787,2020-09-28_12h32.49.371,1_online_exp,2020.1.2,Win32,60,57,,,,,,,,,,,,,,,,,,,,,,,,,,,,,,,,,,,,,,,,,,,,,,,,,,,,,,,,,,,,,,c,1.83758,0,0,0,0,1,,,,,,,,,,,,,,,,,,,,,,,,,,,,,,,,,,,,,,,,,,,,,,,,,,,,,,,,,,,,,,,,,,,,,,,,,,,,,,,,,,,,,,,,,,,,,,,,,,,,,,,,,,,,,,,,,,,,,,,,,,,,,,,,,,,,,,,,,,,,,,,,,,
,,,,,,,,,,,,,,,,,,,,,,,,,,,,,,,,,,,,,,,,,,,,,,,,,,,,,,,,,,,,,,,,,,,,,,,,,,,,,,,,,,,,,,,,,,,,,,,,,,,,,,,,,,,,5e31c0590d43621a12346787,2020-09-28_12h32.49.371,1_online_exp,2020.1.2,Win32,60,57,,,,,,,,,,,,,,,,,,,,,,,,,,,,,,,,,,,space,0.73088,space,0.44861,space,3.05307,space,1.159785,space,1.241035,,,,,,,,,space,0.90478,space,0.700955,0,0,0,0,1,,,,,,,,,,,,,,,,,,,,,,,,,,,,,,,,,,,,,,,,,,,,,,,,,,,,,,,,,,,,,,,,,,,,,,,,,,,,,,,,,,,,,,,,,,,,,,,,,,,,,,,,,,,,,,,,,,,,,,,,,,,,,,,,,,,,,,,,,,,,,,,,,,,,,,,,,
,,,,,,,,,,,,,,,,,,,,,,,,,,,,,,,,,,,,,,,,,,,,,,,,,,,,,,,,,,,,,,,,,,,,,,,,,,,,,,,,,,,,,,,,,,,,,,,,,,,,,,,,,,,,5e31c0590d43621a12346787,2020-09-28_12h32.49.371,1_online_exp,2020.1.2,Win32,60,57,,,,,,,,,,,,,,,,,,,,,,,,,,,,,,,,,,,,,,,,,,,,,,,,,,,,,,,,,,,,,,c,1.30205,1,0,1,0,1,,,,,,,,,,,,,,,,,,,,,,,,,,,,,,,,,,,,,,,,,,,,,,,,,,,,,,,,,,,,,,,,,,,,,,,,,,,,,,,,,,,,,,,,,,,,,,,,,,,,,,,,,,,,,,,,,,,,,,,,,,,,,,,,,,,,,,,,,,,,,,,,,,
,,,,,,,,,,,,,,,,,,,,,,,,,,,,,,,,,,,,,,,,,,,,,,,,,,,,,,,,,,,,,,,,,,,,,,,,,,,,,,,,,,,,,,,,,,,,,,,,,,,,,,,,,,,,5e31c0590d43621a12346787,2020-09-28_12h32.49.371,1_online_exp,2020.1.2,Win32,60,57,,,,,,,,,,,,,,,,,,,,,,,,,,,,,,,,,,,space,0.433265,space,0.419695,space,3.094765,space,1.1466,space,1.82664,,,,,,,,,space,0.530315,space,0.502555,0,0,0,0,1,,,,,,,,,,,,,,,,,,,,,,,,,,,,,,,,,,,,,,,,,,,,,,,,,,,,,,,,,,,,,,,,,,,,,,,,,,,,,,,,,,,,,,,,,,,,,,,,,,,,,,,,,,,,,,,,,,,,,,,,,,,,,,,,,,,,,,,,,,,,,,,,,,,,,,,,,
,,,,,,,,,,,,,,,,,,,,,,,,,,,,,,,,,,,,,,,,,,,,,,,,,,,,,,,,,,,,,,,,,,,,,,,,,,,,,,,,,,,,,,,,,,,,,,,,,,,,,,,,,,,,5e31c0590d43621a12346787,2020-09-28_12h32.49.371,1_online_exp,2020.1.2,Win32,60,57,,,,,,,,,,,,,,,,,,,,,,,,,,,,,,,,,,,,,,,,,,,,,,,,,,,,,,,,,,,,,,c,1.725135,2,0,2,0,1,,,,,,,,,,,,,,,,,,,,,,,,,,,,,,,,,,,,,,,,,,,,,,,,,,,,,,,,,,,,,,,,,,,,,,,,,,,,,,,,,,,,,,,,,,,,,,,,,,,,,,,,,,,,,,,,,,,,,,,,,,,,,,,,,,,,,,,,,,,,,,,,,,
,,,,,,,,,,,,,,,,,,,,,,,,,,,,,,,,,,,,,,,,,,,,,,,,,,,,,,,,,,,,,,,,,,,,,,,,,,,,,,,,,,,,,,,,,,,,,,,,,,,,,,,,,,,,5e31c0590d43621a12346787,2020-09-28_12h32.49.371,1_online_exp,2020.1.2,Win32,60,57,,,,,,,,,,,,,,,,,,,,,,,,,,,,,,,,,,,space,1.01679,space,1.1483,space,2.922965,space,1.30048,space,3.42374,,,,,,,,,space,0.540415,space,0.68446,0,0,0,0,1,,,,,,,,,,,,,,,,,,,,,,,,,,,,,,,,,,,,,,,,,,,,,,,,,,,,,,,,,,,,,,,,,,,,,,,,,,,,,,,,,,,,,,,,,,,,,,,,,,,,,,,,,,,,,,,,,,,,,,,,,,,,,,,,,,,,,,,,,,,,,,,,,,,,,,,,,
,,,,,,,,,,,,,,,,,,,,,,,,,,,,,,,,,,,,,,,,,,,,,,,,,,,,,,,,,,,,,,,,,,,,,,,,,,,,,,,,,,,,,,,,,,,,,,,,,,,,,,,,,,,,5e31c0590d43621a12346787,2020-09-28_12h32.49.371,1_online_exp,2020.1.2,Win32,60,57,,,,,,,,,,,,,,,,,,,,,,,,,,,,,,,,,,,,,,,,,,,,,,,,,,,,,,,,,,,,,,c,1.965305,3,0,3,0,1,,,,,,,,,,,,,,,,,,,,,,,,,,,,,,,,,,,,,,,,,,,,,,,,,,,,,,,,,,,,,,,,,,,,,,,,,,,,,,,,,,,,,,,,,,,,,,,,,,,,,,,,,,,,,,,,,,,,,,,,,,,,,,,,,,,,,,,,,,,,,,,,,,
,,,,,,,,,,,,,,,,,,,,,,,,,,,,,,,,,,,,,,,,,,,,,,,,,,,,,,,,,,,,,,,,,,,,,,,,,,,,,,,,,,,,,,,,,,,,,,,,,,,,,,,,,,,,5e31c0590d43621a12346787,2020-09-28_12h32.49.371,1_online_exp,2020.1.2,Win32,60,57,,,,,,,,,,,,,,,,,,,,,,,,,,,,,,,,,,,space,0.48988,space,0.22999,space,0.21204,space,0.1792,space,0.16742,,,,,,,,,space,1.117945,space,0.117345,,,,,,,,,,,,,0,0,0,0,1,,,,,,,,,,,,,,,,,,,,,,,,,,,,,,,,,,,,,,,,,,,,,,,,,,,,,,,,,,,,,,,,,,,,,,,,,,,,,,,,,,,,,,,,,,,,,,,,,,,,,,,,,,,,,,,,,,,,,,,,,,,,,,,,,,,,,,,,,,,,,
,,,,,,,,,,,,,,,,,,,,,,,,,,,,,,,,,,,,,,,,,,,,,,,,,,,,,,,,,,,,,,,,,,,,,,,,,,,,,,,,,,,,,,,,,,,,,,,,,,,,,,,,,,,,5e31c0590d43621a12346787,2020-09-28_12h32.49.371,1_online_exp,2020.1.2,Win32,60,57,,,,,,,,,,,,,,,,,,,,,,,,,,,,,,,,,,,,,,,,,,,,,,,,,,,,,,,,,,,,,,,,,,,,,,,,,,5,5.503525,0,0,0,0,1,,,,,,,,,,,,,,,,,,,,,,,,,,,,,,,,,,,,,,,,,,,,,,,,,,,,,,,,,,,,,,,,,,,,,,,,,,,,,,,,,,,,,,,,,,,,,,,,,,,,,,,,,,,,,,,,,,,,,,,,,,,,,,,,,,,,,,
,,,,,,,,,,,,,,,,,,,,,,,,,,,,,,,,,,,,,,,,,,,,,,,,,,,,,,,,,,,,,,,,,,,,,,,,,,,,,,,,,,,,,,,,,,,,,,,,,,,,,,,,,,,,5e31c0590d43621a12346787,2020-09-28_12h32.49.371,1_online_exp,2020.1.2,Win32,60,57,,,,,,,,,,,,,,,,,,,,,,,,,,,,,,,,,,,,,,,,,,,,,,,,,,,,,,,,,,,,,,c,2.177045,4,0,4,0,1,,,,,,,,,,,,,,,,,,,,,,,,,,,,,,,,,,,,,,,,,,,,,,,,,,,,,,,,,,,,,,,,,,,,,,,,,,,,,,,,,,,,,,,,,,,,,,,,,,,,,,,,,,,,,,,,,,,,,,,,,,,,,,,,,,,,,,,,,,,,,,,,,,
,,,,,,,,,,,,,,,,,,,,,,,,,,,,,,,,,,,,,,,,,,,,,,,,,,,,,,,,,,,,,,,,,,,,,,,,,,,,,,,,,,,,,,,,,,,,,,,,,,,,,,,,,,,,5e31c0590d43621a12346787,2020-09-28_12h32.49.371,1_online_exp,2020.1.2,Win32,60,57,,,,,,,,,,,,,,,,,,,,,,,,,,,,,,,,,,,space,0.313925,space,0.25184,space,0.89475,space,0.362345,space,0.331135,,,,,,,,,space,0.57274,space,0.65724,0,0,0,0,1,,,,,,,,,,,,,,,,,,,,,,,,,,,,,,,,,,,,,,,,,,,,,,,,,,,,,,,,,,,,,,,,,,,,,,,,,,,,,,,,,,,,,,,,,,,,,,,,,,,,,,,,,,,,,,,,,,,,,,,,,,,,,,,,,,,,,,,,,,,,,,,,,,,,,,,,,
,,,,,,,,,,,,,,,,,,,,,,,,,,,,,,,,,,,,,,,,,,,,,,,,,,,,,,,,,,,,,,,,,,,,,,,,,,,,,,,,,,,,,,,,,,,,,,,,,,,,,,,,,,,,5e31c0590d43621a12346787,2020-09-28_12h32.49.371,1_online_exp,2020.1.2,Win32,60,57,,,,,,,,,,,,,,,,,,,,,,,,,,,,,,,,,,,,,,,,,,,,,,,,,,,,,,,,,,,,,,c,1.623235,5,0,5,0,1,,,,,,,,,,,,,,,,,,,,,,,,,,,,,,,,,,,,,,,,,,,,,,,,,,,,,,,,,,,,,,,,,,,,,,,,,,,,,,,,,,,,,,,,,,,,,,,,,,,,,,,,,,,,,,,,,,,,,,,,,,,,,,,,,,,,,,,,,,,,,,,,,,
,,,,,,,,,,,,,,,,,,,,,,,,,,,,,,,,,,,,,,,,,,,,,,,,,,,,,,,,,,,,,,,,,,,,,,,,,,,,,,,,,,,,,,,,,,,,,,,,,,,,,,,,,,,,5e31c0590d43621a12346787,2020-09-28_12h32.49.371,1_online_exp,2020.1.2,Win32,60,57,,,,,,,,,,,,,,,,,,,,,,,,,,,,,,,,,,,space,0.197195,space,0.177595,space,0.160105,space,0.17234,space,0.183905,,,,,,,,,space,0.337125,space,0.22678,0,0,0,0,1,,,,,,,,,,,,,,,,,,,,,,,,,,,,,,,,,,,,,,,,,,,,,,,,,,,,,,,,,,,,,,,,,,,,,,,,,,,,,,,,,,,,,,,,,,,,,,,,,,,,,,,,,,,,,,,,,,,,,,,,,,,,,,,,,,,,,,,,,,,,,,,,,,,,,,,,,
,,,,,,,,,,,,,,,,,,,,,,,,,,,,,,,,,,,,,,,,,,,,,,,,,,,,,,,,,,,,,,,,,,,,,,,,,,,,,,,,,,,,,,,,,,,,,,,,,,,,,,,,,,,,5e31c0590d43621a12346787,2020-09-28_12h32.49.371,1_online_exp,2020.1.2,Win32,60,57,,,,,,,,,,,,,,,,,,,,,,,,,,,,,,,,,,,,,,,,,,,,,,,,,,,,,,,,,,,,,,c,1.310375,6,0,6,0,1,,,,,,,,,,,,,,,,,,,,,,,,,,,,,,,,,,,,,,,,,,,,,,,,,,,,,,,,,,,,,,,,,,,,,,,,,,,,,,,,,,,,,,,,,,,,,,,,,,,,,,,,,,,,,,,,,,,,,,,,,,,,,,,,,,,,,,,,,,,,,,,,,,
,,,,,,,,,,,,,,,,,,,,,,,,,,,,,,,,,,,,,,,,,,,,,,,,,,,,,,,,,,,,,,,,,,,,,,,,,,,,,,,,,,,,,,,,,,,,,,,,,,,,,,,,,,,,5e31c0590d43621a12346787,2020-09-28_12h32.49.371,1_online_exp,2020.1.2,Win32,60,57,,,,,,,,,,,,,,,,,,,,,,,,,,,,,,,,,,,space,0.46101,space,1.583035,space,3.165365,space,1.22751,space,1.070295,,,,,,,,,space,1.08489,space,0.538935,0,0,0,0,1,,,,,,,,,,,,,,,,,,,,,,,,,,,,,,,,,,,,,,,,,,,,,,,,,,,,,,,,,,,,,,,,,,,,,,,,,,,,,,,,,,,,,,,,,,,,,,,,,,,,,,,,,,,,,,,,,,,,,,,,,,,,,,,,,,,,,,,,,,,,,,,,,,,,,,,,,
